{
  "apiVersion": "synthrange/v1alpha1",
  "kind": "RunState",
  "metadata": {
    "runId": "bounded-web-discovery-001"
  },
  "status": {
    "state": "created",
    "sequence": 0,
    "updatedAt": "2026-01-01T00:00:00Z",
    "startedAt": null,
    "endedAt": null,
    "stopReason": null,
    "evidenceSealed": false,
    "actors": {
      "red": {
        "state": "pending",
        "requiredOutputs": ["red/observations.md", "red/report.md"],
        "completedAt": null
      },
      "blue": {
        "state": "pending",
        "requiredOutputs": ["blue/observations.md", "blue/report.md"],
        "completedAt": null
      }
    },
    "history": []
  }
}
